<!ELEMENT persoane (persoana+)>
<!ELEMENT persoana (nume, prenume, varsta, adresa, educatie, job)>
<!ATTLIST persoana id CDATA #REQUIRED>

<!ELEMENT nume (#PCDATA)>
<!ELEMENT prenume (#PCDATA)>
<!ELEMENT varsta (#PCDATA)>

<!ELEMENT adresa (strada, numar, localitate, judet, tara)>
<!ELEMENT strada (#PCDATA)>
<!ELEMENT numar (#PCDATA)>
<!ELEMENT localitate (#PCDATA)>
<!ELEMENT judet (#PCDATA)>
<!ELEMENT tara (#PCDATA)>

<!ELEMENT educatie (#PCDATA)>
<!ELEMENT job (#PCDATA)>
